{
  "subject": "agents/agents/code-reviewer.md",
  "type": "new-agent",
  "date": "2026-05-01T00:41:49.979463+00:00",
  "commit": "0380224",
  "verifications": [
    {
      "name": "code-reviewer フォーマット検証",
      "result": "pass",
      "note": "validate_subagents.py で全16フィールドの整合性を確認済み",
      "command": "log"
    }
  ],
  "hmac_sha256": "866d48101444dbe2813d6148e867aba0cd77f409996d30ab38aa18c3ebadf10c"
}
