{
  "subject": "scripts/create-subagent.sh",
  "type": "new-script",
  "date": "2026-05-01T00:38:04.273846+00:00",
  "commit": "0380224",
  "verifications": [
    {
      "name": "正常系: 新規エージェント作成",
      "command": "make create-agent NAME=evidence-test-agent",
      "exit_code": 0,
      "stdout_snippet": "=== 新規 Subagent 作成: evidence-test-agent ===\n\n[1/4] テンプレートをコピーしました: /home/ubuntu/100x-engineering-agents/agents/agents/evidence-test-agent.md\nOK: evidence-test-agent をマニフェストに登録しました\n[2/4] マニフェストに登録しました（HMAC-SHA256 署名付き）\n\n  次のステップ:\n    1. /home/ubuntu/100x-engineering-agents/agents/agents/evidence-test-agent.md を開いて description, tools 等を編集してください\n    2. frontmatter 以降にシステムプロンプト（本文）を記述してください\n    3. 編集完了後、以下のコマンドでバリデーションを実行してください:\n\n       make validate\n       # または\n       python scripts/validate_subagents.py /home/ubuntu/100x-engineering-agents/agents/agents/evidence-test-agent.md\n\n[3/4] 現在の状態でバリデーションを実行...\n\nClaude Code Subagent Frontmatter Validator\nSchema: agents/schemas/subagent-frontmatter.schema.json\n対象: 1 ファイル\n============================================================\n\nPASS: agents/agents/evidence-test-agent.md\n\n============================================================\n結果: 1 passed / 0 failed / 1 total\n\n[4/4] バリデーション PASS\n\n=== 作成完了 ===\n  ファイル:       /home/ubuntu/100x-engineering-agents/agents/agents/evidence-test-agent.md\n  マニフェスト:   agents/agents/.manifest.json\n  検証:           make validate\n  レポート:       make report\n",
      "result": "pass"
    },
    {
      "name": "異常系: 重複エージェント名の拒否",
      "command": "make create-agent NAME=code-reviewer",
      "exit_code": 2,
      "stdout_snippet": "ERROR: /home/ubuntu/100x-engineering-agents/agents/agents/code-reviewer.md は既に存在します\n",
      "result": "fail",
      "stderr_snippet": "make: *** [Makefile:64: create-agent] Error 1\n"
    },
    {
      "name": "異常系: 重複エージェント名の拒否",
      "command": "make create-agent NAME=code-reviewer",
      "exit_code": 2,
      "stdout_snippet": "ERROR: /home/ubuntu/100x-engineering-agents/agents/agents/code-reviewer.md は既に存在します\n",
      "result": "fail",
      "stderr_snippet": "make: *** [Makefile:64: create-agent] Error 1\n"
    },
    {
      "name": "異常系: 不正な名前フォーマットの拒否",
      "command": "make create-agent NAME=My_Agent",
      "exit_code": 2,
      "stdout_snippet": "ERROR: エージェント名は小文字英数字とハイフンのみ使用可能です\n  OK:  my-agent, code-reviewer, a\n  NG:  My_Agent, UPPERCASE, -leading-hyphen\n",
      "result": "fail",
      "stderr_snippet": "make: *** [Makefile:64: create-agent] Error 1\n"
    }
  ],
  "hmac_sha256": "0b434c7f860f71cbb14b5a976101e3cefb9ad5dfcb5b52761f24e824f353dcd7"
}
