{
  "subject": "scripts/manifest.py",
  "type": "new-script",
  "date": "2026-05-01T00:41:55.286994+00:00",
  "commit": "0380224",
  "verifications": [
    {
      "name": "正常系: マニフェスト検証",
      "command": "python3 scripts/manifest.py verify",
      "exit_code": 0,
      "stdout_snippet": "マニフェスト検証: 6 passed / 0 failed\n",
      "result": "pass"
    },
    {
      "name": "異常系: マニフェスト未登録ファイルの検出",
      "command": "python3 scripts/manifest.py verify",
      "exit_code": 0,
      "stdout_snippet": "マニフェスト検証: 6 passed / 0 failed\n",
      "result": "pass"
    },
    {
      "name": "異常系: マニフェスト未登録ファイルの検出",
      "command": "python3 scripts/manifest.py verify",
      "exit_code": 1,
      "stdout_snippet": "マニフェスト検証: 6 passed / 1 failed\n  FAIL: rogue-agent — マニフェスト未登録（make create-agent NAME=rogue-agent を実行してください）\n",
      "result": "fail"
    }
  ],
  "hmac_sha256": "42986d175f7ee3beacc131273ed344a4fd801e349ee7c0ebf7115d11381ceaf6"
}
